"Company","Country","Month","Year","Classification","Keywords","Website","Funding Amount","Funding Type","Investors"
"Kerecis Limited","USA","Aug","2020","Medical Devices","","","$21 Million","Series C","Silcon Valley Bank"
"Freenome","USA","Aug","2020","Medical Diagnostics","","","$270 Million","Series C","Bain Capital Life Sciences , Perceptive Advisors, Fidelity Management & Research Company, Janus Henderson Investors, Farallon Capital Management, Rock Springs Capital, Cormorant Asset Management, EcoR1 Capital, Catalio Capital Management and the Colorectal Cancer Alliance."
"Clene Nanomedicine","USA","Aug","2020","Nanotechnology","","","$42.5 Million ","Series D","SymBiosis II, LLC"
"Phosplatin Therapeutics LLC","USA","Aug","2020","Early Stage Biotech","","","$18.4 Million","Series A","Undisclosed Family Offices"
"PMV Pharmaceuticals, Inc.","USA","Aug","2020","Early Stage Biotech","","","$70 Million","Series D","Avoro Capital, RA Capital Management, and Wellington Management Company OrbiMed Advisors, Nextech Invest, Viking Global Investors, and Boxer Capital of Tavistock Group"
"iVeena","USA","Aug","2020","Early Stage Biotech","","","NA","Series B","Undisclosed"
"DiscGenics","USA","Aug","2020","Early Stage Biotech","","","$50 Million","Series C","Ci:z Investment LLP , Eagle Fund SP1 LLP, Medical Incubator Japan (MIJ), and CareNet of Japan, Mitsubishi UFJ Capital Co. Ltd, "
"PatientPop","USA","Aug","2020","Digital Health","","","$50 Million","Series C","HLM Venture Partners, Commonfund and Vivo Capital, Toba Capital, Transformation Capital, and Silicon Valley Bank."
"Connect Biopharma","China","Aug","2020","Early Stage Biotech","","","$115 Million","Series C","RA Capital Management as well as Lilly Asia Ventures and Qiming Venture Partners"
"ReViral","USA","Aug","2020","Early Stage Biotech","","","$44 Million","Series C","CR-CP Life Science Fund. Additional investors participating in the financing include Andera Partners, Brace Pharma Capital, Green Sands Equity, New Leaf Venture Partners, Novo Holdings, OrbiMed Advisors, and Perceptive Advisors."
"Triumvira Immunologics","USA","Aug","2020","Early Stage Biotech","","","$55 Million","Series A","Bayer AG,  Northpond Ventures.  Oceanpine Capital and Viva Biotech Holdings, Bloom Burton & Co. and the Centre for Commercialization of Cancer Immunotherapy (C3i)."
"ACTO","USA","Aug","2020","Healthcare Analytics","","","$11.5 Million","Series A","Resolve Growth Partners, Salesforce Ventures,  Panache Ventures."
"ExoCoBio Inc.","South Korea","Aug","2020","Early Stage Biotech","","","$9.3 Million","Series C","K2 Investment Partners, SBI Investment Korea, and Dt & Investment , G.N.Tech/ReeHu Investment and Focus Assets Management. KNOTUS, "
"Translational Imaging Innovations, Inc.","USA","Aug","2020","Medical Imaging","","","$1.5 Million","Grant Funding","SBIR National Institutes of Healtj (NIH)"
"Kinnate Biopharma","USA","Aug","2020","Early Stage Biotech","","","$98 Million","Series C","RA Capital Management , Viking Global Investors; Venrock Healthcare Capital Partners; Fidelity Management & Research Company, LLC; Janus Henderson Investors; Surveyor Capital (a Citadel company); Boxer Capital of Tavistock Group; Logos Capital; SVB Leerink.  Foresite Capital, OrbiMed, Nextech Invest, and Vida Ventures"
"Synthego","USA","Aug","2020","Genomics/Gene Therapy","","","$100 Million","Series D"," Wellington Management,  RA Capital Management, 8VC,  Founders Fund, Menlo Ventures, and Intel Capital. "
"LUCA Science","Japan","Sep ","2020","Early Stage Biotech","","","$9.8 Million","Series A","Axil Capital Partners. Remiges Ventures, Nippon Venture Capital, Fast Track Initiative and CaHC"
"Lumen Biosciences","USA","Sep ","2020","Early Stage Biotech","","","$16 Million","Series B","WestRiver Management ,Bioeconomy Capital,  Avista Development, Columbia Pacific"
"PicnicHealth","USA","Sep","2020","Digital Health","","","$35 Million","Series B","Felicis Ventures, Amplify Partners"
"Stella Diagnostics","USA","Sep","2020","Medical Diagnostics","","","NA","Seed","Keystone Capital Partners"
"Biofourmis","USA","Sep","2020","Healthcare Analytics","","","$100 Million","Series C","SoftBank Vision Fund 2,Openspace Ventures, MassMutual Ventures, Sequoia Capital and EDBI."
"Picnic Health","USA","Sep","2020","Digital Health","Patient Health data platform","https://picnichealth.com/","$35 Million","Series B","Felicis Ventures, Amplify Partners"
"IcanoMAB GmbH","Germany","Sep","2020","Early Stage Biotech","Mab, Oncology, Immune-Modulation, Acute Inflammation, COVID-19, Acute Respiratory Distress Syndrome (ARDS) and Cytokine Release Syndrome (CRS)","https://icanomab.com/","Unknown","Seed","NA"
"Nanospectra Biosciences","USA","Sep","2020","Medical Devices","ultra-focal ablation therapy, AuroLase®, prostate cancer","https://nanospectra.com/  ","$3 Million","Series B-1","Sirtex Medical "
"Manifold Bio","USA","Sep","2020","BioSystems","protein barcoding platform, protein designs","https://manifold.bio/","$5.4 Million","Seed","Playground Global, pre-seed lead Fifty Years and early investors GETTYLAB and Allston Venture Fund"
"CoreMap Medical","USA","Sep","2020","Medical Devices","Atrial Fibrillation (AF),  diagnostic technology for drivers of AF","https://coremapmedical.com/","$10.5 Million","Series A","Qure Ventures,Fifth Focus/HRMG Investment, Orbimed Venture Partners"
"VECT-HORUS","France","Sep","2020","BioSystems","VECTrans® Platform, vector design, targeted delivery, diagnosis of glioblastoma, spin-off of the Institute for Neurophysiopathology (INP, UMR7051, CNRS and Aix Marseille University)","https://www.vect-horus.com/","€6.7 Million","Series B","NA"
"ACT Genomics","Taiwan","Sep","2020","Bioinformatics","DNA sequencing, cancer diagnosis, cancer risk assessment and immunotherapy evaluation","http://www.actgenomics.com/","NA","Series A","Aflac Ventures LLC and Kyoto University Innovation Capital. CLSA Capital Partners' managed private equity funds, OEP, Hotung Venture Capital, UMC Capital, CDIB Capital, JAFCO Asia, HKSTP Ventures and UOB Venture Management Pte Ltd."
"MiNA Therapeutics","USA","Sep","2020","Early Stage Biotech","RNA activation therapeutics, MTL-CEBPA, SaRNA platform, Cancer, Oncology","https://minatx.com/","£23 million ($30 million)","Series A","aMoon"
"Oncomfort","Belgium","Sep","2020","Digital Health","Digital Sedation, Sedakit, therapeutic Virtual Reality, digital therapy","https://www.oncomfort.com/en","€10 Million","Series A","Debiopharm and Crédit Mutuel Innovation"
"Casma Therapeutics","USA","Sep","2020","Early Stage Biotech","muscular dystrophy, autophagy degrader platform, TRPML1 agonist. Liver disorders, inflammatory, neurdegeneration","https://www.casmatx.com/","$50 Million","Series B","The Column Group (TCG), adds new investors Eventide Asset Management, LLC and Schroder Adveq"
"Arna Genomics","USA","Sep","2020","Medical Diagnostics","Arna Breast diagnostic test. Liquid biopsy","https://arna.bio/","$3.5 Million","Series A","Xploration Capital"
"Catalog","USA","Sep","2020","Bioinformatics","Shannon DNA writing and data storage platform","https://www.catalogdna.com/","$10 Million","Series A","Horizons Ventures"
"iotaMotion","USA","Sep","2020","Medical Devices","iotaSOFT™ robotic surgical system, cochlear implantation","https://iotamotion.com/","$1.65 Million","Grant Funding","NIH"
"OncoImmune","USA","Sep","2020","Early Stage Biotech","oncology, inflamation, GVHD, CD24Fc , Onc-392, echinomycin, ONC-781 Bispecific and ONC-781 CAR-T","http://www.oncoimmune.com/","$56 Million","Series B","HM Capital,3E Bioventures Capital and Kaitai Capital, in addition to new investors GBA Fund and GF Xinde"
"Korro Bio","USA","Sep","2020","Early Stage Biotech","RNA Therapeutics, RNA editing, OPERA platform","https://www.korrobio.com/","$91.5 Million","Series A","Wu Capital with participation from current investors, Atlas Venture and New Enterprise Associates. Additional new investors include Qiming Venture Partners USA, Surveyor Capital (a Citadel company), Cormorant Asset Management, MP Healthcare Venture Management and Alexandria Venture Investments"
"BitBiome","Japan","Sep","2020","BioSystems","Microbiome,  single-cell bacterial sequencing services. Microfluidics","https://www.bitbiome.co.jp/en/","¥700 million ($6.6 million) ","Series B","University of Tokyo Edge Capital Partners"
"Attralus","USA","Sep","2020","Early Stage Biotech","ATTR (transthyretin),  systemic amyloidosis","https://www.attralus.com/ ","$25 Million","Series A","venBio Partners"
"Umoja Biopharma","USA","Sep","2020","Early Stage Biotech","cancer, oncology. cellular immunotherapy platform, in vivo delivery, RACR/CAR synthetic receptor payload and TumorTag targeting technologies","https://www.umoja-biopharma.com/ ","$53 Million","Series A","MPM Capital and Qiming Venture Partners USA"
"Pharvaris","USA","Sep","2020","Early Stage Biotech"," oral bradykinin-B2-receptor antagonists, hereditary angioedema (HAE) ,  edema (swelling)","https://pharvaris.com/","$80 Million","Series C","Viking Global Investors and General Atlantic co-led the financing, with participation by Cormorant Asset Management. Current investors Foresite Capital, Bain Capital Life Sciences, venBio Partners, and Venrock Healthcare Capital Partners"
"COTA Inc.","USA","Sep","2020","Healthcare Analytics","cancer, longitudinal real world data, EHR, EMR, oncology"," https://cotahealthcare.com/","$10 Million","Grant Funding","Varian Medical Systems"
"Elpis Biopharmaceuticals","USA","Sep","2020","Early Stage Biotech"," solid tumor and hematological disease therapeutics.  mRNADis™ antibody discovery and mSCAFold™ rational protein engineering platforms, immuno-oncology product candidates EPIM-001, a bispecific and engineered dual functional IL-2Rβ agonist with minimal IL-2Rα activation to treat solid tumor indications, and EPC-001, a CD19/CD22 dual targeting CAR-T to treat B Cell malignancies ","https://elpisbiopharmaceuticals.com/","$30 Million","Series A","NA"
"ARIZ Precision Medicine","USA","Sep","2020","Early Stage Biotech","Oncogene Targeting Platform, PRDM gene and protein family, hematological and solid tumors, oncology, cancer","https://arizbio.com/","$685,000 ","Seed","Moneta Ventures"
"Replica Analytics","USA","Sep","2020","Healthcare Analytics"," Replica Synthesis, privacy-protected synthetic data, Data Synthesis Innovations","https://replica-analytics.com/home","$1 Million","Pre-Seed","FACIT,MITACS"
"Recursion Pharma","USA","Sep","2020","Healthcare Analytics","drug discovery platform, AI, digital biology","https://www.recursionpharma.com/","$239 Million","Series D","Leaps By Bayer, Casdin Capital, Catalio Capital Management, Laurion Capital Management, Samsara BioCapital"
"MicroGem","USA","Sep","2020","Medical Diagnostics","COVID-19 saliva test,  SARS-CoV-2,  influenza A and B, RT-PCR","https://microgembio.com/our-company/","$40.9 Million","Grant Funding","NIH"
"Ceres Nanosciences","USA","Sep","2020","Medical Diagnostics","COVID-19, Nanotrap Virus Particles, respiratory syncytial tests","https://www.ceresnano.com/about","$6.9 Million","Grant Funding","NIH"
"Aegis Sciences","USA","Sep","2020","Medical Diagnostics","COVID-19, RT-PCR SARS-CoV-2 test, multiplexed SARS-CoV-2, influenza A and B test","https://www.aegislabs.com/","$6.6 Million","Grant Funding","NIH"
"Immune Regulation","UK","Sep","2020","Early Stage Biotech","autoimmune and allergic diseases","https://immuneregulation.com/","$53.4 Million","Series B","Morningside Ventures, 24Haymarket"
"GeneWerk GmbH","Germany","Sep","2020","Genomics/Gene Therapy","gene therapy testing, vector integration site analysis (ISA) services","https://www.genewerk.com/en/","NA","Series A","Ampersand Capital Partners"
"BioProtect","Israel","Sep","2020","Early Stage Biotech","Prostate cancer, ProSpace™ balloon spacer, bioabsorbable polymer spacer balloon platform","https://bioprotect.com/","$25 Million","Series D","Peregrine Ventures, Almeda Ventures, KB Investments of South Korea and Triventures"
"Novellus","Israel","Sep","2020","Early Stage Biotech","oncology, oncogene drivers, mutations, PLX-8394,  BRAF fusions ,glioma","https://novellus.bio/","$57 Million","Series C","Pontifax, OrbiMed Advisors, HBM Healthcare Investments, Wellington Management, Cormorant Asset Management, Novartis Venture Fund (NVF), SR One"
"NeuroTherapia, Inc.","USA","Sep","2020","Early Stage Biotech","neurodegenerative diseases, NTRX-07,  neuroinflammation","https://www.neurotherapia.com/","$8.8 Million","Series A","Brain Trust Accelerator Fund II, The Cleveland Clinic Foundation, Dolby Family Ventures and Alzheimer's Drug Discovery Foundation"
"PEDRA™ Technology, Inc.","Singapore","Sep","2020","Medical Devices","limb saving, deep-tissue perfusion monitors.  peripheral arterial disease (PAD) and critical limb ischemia (CLI), detection of compromised tissue perfusion in diabetic feet","https://www.pedratech.com/","$4.7 Million","Series A","SEEDS Capital, the investment arm of Enterprise Singapore,  M&L Healthcare Investments"
"Medasense","Israel","Sep","2020","Medical Devices","NOL technology, pain-response monitoring,  unique multi-parametric sensor platform and advanced AI algorithms , COVID-19, ventilation","https://medasense.com/","$18 Million","Series C","Sabadell Asabys venture capital firm (Asabys Partners, Spain),  Baxter Ventures, Olive Tree Ventures and LGL Capital"
"Siolta Therapeutics","USA","Sep","2020","Early Stage Biotech","Allergic Diseases, live biotherapeutic product (LBP) platform, microbiome-based medicines and diagnostics","https://www.sioltatherapeutics.com/","$30 Million","Series B"," Khosla Ventures and Marc Benioff as well as new investors Seventure (Health for Life Capital Fund), SymBiosis, and Global Brain (Kirin Health Innovation Fund/GB-VII)"
"NotCo","Chile","Sep","2020","Agri-Biotech","plant biotech, plant-based alternatives, NotMilk, NotBurger, NotIceCream and NotMayo","https://notco.com/us/","$85 Million","Series C","Future Positive, L Catterton, Kaszek Ventures, The Craftory, Bezos Expedition, General Catalyst, Endeavor Catalyst, Indie Bio, Humbolt Capital, and Maya Capital"
"Hexagon Bio","USA","Sep","2020","Early Stage Biotech","discovery platform,  secondary metabolites,  fungal genomes, synthetic biology platform called Hex, proprietary genomics database of new secondary metabolites, drug discovery","https://www.hexagonbio.com/","$47 Million","Series A","The Column Group and included 8VC and Two Sigma Ventures"
"Orasis Pharmaceuticals","Israel","Sep","2020","Early Stage Biotech","presbyopia, CSF-1, near vision, corrective eye drop","https://www.orasis-pharma.com/","$30 Million","Series C","Bluestem Capital , Visionary Ventures,  Sequoia Capital, SBI (Japan) Innovation Fund, Maverick Ventures Israel, LifeSci Venture Partners"
"Spine Align","USA","Sep","2020","Medical Devices","spinal alignment, LiveAlign, Spine Align platform, spine surgery","https://www.spinealignsurgical.com/","$1.75 Million","Seed","Rockies Venture Club, with additional support by members of the Berkeley Angel Network, NO/LA Angel Network, Pasadena Angels, Bellingham Angels, the Abell Foundation, and VentureWell"
"ESCAPE Bio","USA","Sep","2020","Early Stage Biotech","Precision Neurology Medicines, Genetic Neurodegeneration, ESB1609, mutant-selective LRRK2 G2019S kinase inhibitor, Parkinson’s Disease (PD)","https://www.escapebio.com/","$73 Million","Series D","Wellington Management Company LLP. Additional new  Avidity Partners, CAM Capital, New Leaf Ventures, Rock Springs Capital, Surveyor Capital (a Citadel company) and Sphera Funds Management,  OrbiMed, Novo Holdings, Johnson & Johnson Innovation, Novartis Venture Fund, Osage University Partners and Sutter Hill Venture"
"Neogene Therapeutics","USA","Sep","2020","Early Stage Biotech","Oncology, cancer, neo-antigen T cell therapies","https://www.neogene.com/","$110 Million","Series A","EcoR1 Capital, Jeito Capital and Syncona, with participation from Polaris Partners and Pontifax. Seed investors Vida Ventures, TPG and Two River"
"Attralus","USA","Sep","2020","Rare Disease","Rare Disease, Systemic Amyloidosis,  pan-amyloid imaging agent, AT-01, AT-02, AT-03, ATTR (transthyretin), AL (light chain) and potentially ALECT2 systemic amyloidosis","https://www.attralus.com/","$25 Million","Series A","venBio Partners"
"Escient Pharmaceuticals","USA","Sep","2020","Early Stage Biotech","Mast cell therapies, Cholestatic and Uremic Pruritus, EP547, a MRGPR-targeted Therapy","https://www.escientpharma.com/","$77.5 Million","Series B","Sanofi Ventures and Cowen Healthcare Investments ,Redmile Group and Perceptive Advisors"
"Rejoni, Inc.","USA","Sep","2020","Medical Devices","gynecological surgical procedures, biomaterials","http://www.rejoni.com/","$15 Million","Series A","Ascension Ventures, Delos Capital and Sparta Group."
"Quadrant Biosciences","USA","Sep","2020","Medical Diagnostics","microRNA diagnostic test, Saliva test,concussions","https://www.quadrantbiosciences.com/","$2.3 Million","Grant Funding","NIH"
"Antelope Dx","Belgium","Sep","2020","Medical Diagnostics","COVID-19, urine-based self-test, Chlamydia trachomatis and Neisseria gonorrhoeae, respiratory test for influenza A/B and SARS-CoV-2, Protein biomarkers","https://www.antelope-dx.com/","€9 Million","Series B","Whitefund, Noshaq Investment Manager"
"Oligomerix","USA","Sep","2020","Early Stage Biotech","Alzheimer's Disease,  neurodegenerative disorders","http://oligomerix.com/","$3.19 Million","Grant Funding","NIH"
"Ansa Biotechnologies","USA","Sep","2020","Early Stage Biotech"," DNA synthesis technology, synthetic biology","https://ansabio.com/","$7.9 Million","Seed","Horizons Ventures, with participation from Mubadala Capital, Humboldt Fund, Fifty Years"
"Synthekine","USA","Sep","2020","Early Stage Biotech","Cytokine therapies, cancer and autoimmune disease, Interleukin-2","https://www.synthekine.com/","$82 Million","Series A","Canaan Partners, Samsara BioCapital and The Column Group"
"Finch Therapeutics","USA","Sep","2020","Early Stage Biotech","C. Difficile Infection, CP101, autism spectrum disorder (ASD),  chronic hepatitis B (HBV)","https://finchtherapeutics.com/","$90 Million","Series D","Baupost Group, Humboldt Fund, MSD Capital, MSD Partners, Octave Group, and OMX Ventures. Existing investors included Avenir Growth Capital, OCV Partners, Shumway Capital, SIG, SymBiosis, TPTF, and Willett Advisors"
"RapidAI","USA","Sep","2020","Healthcare Analytics","Cerebrovascular Imaging, stroke, AI, Rapid® platform ","https://www.rapidai.com/","$25 Million","Series B","Lennertz & Co"
"XWPharma","USA","Sep","2020","Early Stage Biotech","Neurobiology, XW10172, a GABAB receptor agonist, sleep disorders in narcolepsy, Parkinson’s disease, XW10508, a glutamatergic NMDA antagonist and AMPA activator,, depressive disorder, chronic pain","https://www.xwpharma.com/","$40 Million","Series C","Panacea Venture, Johnson & Johnson Innovation – JJDC, Inc., WI Harper Group, WuXi AppTec’s Corporate Venture Fund and KTB Network, and new investors, CDIB Yida Healthcare Fund, Hontai Capital and Trinity Fund."
"Lava Therapeutics","USA","Sep","2020","Early Stage Biotech","oncology, cancer, bispecific gamma delta T-cell engagers, solid tumors, henatlogic malignancies","https://lavatherapeutics.com/","$83 Million","Series C","Novo Ventures and Sanofi Ventures, Redmile Group, Ysios Capital and BB Pureos Bioventures. Current investors Versant, Gilde Healthcare and MRL Ventures Fund"
"ImmVira","China","Sep","2020","Early Stage Biotech","oncology, cancer, solid tumors, MVR-T3011, intratumoral oncolytic virus program","https://www.immvira-theravir.com/","$10 Million","Series B","Shanghai Healthcare Capital "
"Rediscovery Life Sciences","USA","Sep","2020","Early Stage Biotech","acute kidney injury, drug repurposing, suramin","https://www.rediscoveryls.com/","$4.5 Million","Series B","REX Health Ventures (the investment arm of UNC
REX Healthcare) and Orlando Health Ventures"
"Libra Therapeutics","USA","Sep","2020","Early Stage Biotech","neuro degenrative diseases, amyotrophic lateral sclerosis (ALS) and frontotemporal dementia (FTD)","https://www.libratherapeutics.com/","$29 Million","Series A","Boehringer Ingelheim Venture Fund (BIVF), Epidarex Capital, and Santé. The round was joined by Yonjin Venture, Dolby Family Ventures, and Sixty Degree Capital."
"EBAMed","Switzerland","Sep","2020","Medical Devices","Heart Arrhythmias, cardiac motion management, monitor heart movements","https://eba-med.com/","€2.4 Million","Grant Funding","Enhanced European Innovation Council (EIC)"
"Immetas Therapeutics","USA","Sep","2020","Early Stage Biotech"," cancer and inflammatory disease, cancer, oncology, aging, inflammation","https://immetas.com/","$11 Million","Series A","Morningside Ventures"
"Ardigen","Poland","Sep","2020","Healthcare Analytics","AI, precision medicine, TCR therapy platform, immuno-oncology, cancer, oncology,  neoantigen prediction platform","https://ardigen.com/","$5.4 Million","Grant Funding","Undisclosed"
"Silverback Therapeutics","USA","Sep","2020","Early Stage Biotech","oncology, cancer, SBT6050, a TLR8 agonist,  HER2-directed antibody","https://silverbacktx.com/","$85 Million","Series C","EcoR1 Capital led the round, with participation from new investors including Boxer Capital of Tavistock Group, Fidelity Management & Research Company LLC, Nantahala Capital Management, and RA Capital. OrbiMed Advisors, U.S. Venture Partners, Nextech Invest Ltd., Hunt Technology Ventures, and Pontifax Venture Capital"
"Babson Diagnostics","USA","Sep","2020","Medical Diagnostics","lab-quality blood samples, blood diagnostics","https://www.babsondx.com/","$13.7 Million","Series A","Prism Ventures and other investors. The round’s final total was backed by additions from Siemens, plus Genesis Merchant Capital and Lago Consulting Group."
"XtalPi","USA","Sep","2020","Healthcare Analytics","drug molecule designer, AI platform","https://www.xtalpi.com/en/","$319 Million","Series A","SoftBank’s Vision Fund 2, PICC Capital and Morningside Venture Capital, alongside follow-on investments from the company’s previous backers Tencent, Sequoia China, China Life and SIG"
"Palladio Bio","USA","Sep","2020","Rare Disease","orphan diseases of the kidney","https://palladiobio.com/","$20 Million","Series B","Samsara BioCapital, with participation from new investor, the Roche Venture Fund and existing investors, Medicxi and Osage University Partners"
"LB Pharmaceuticals Inc","USA","Sep","2020","Early Stage Biotech","schizophrenia, CNS, neurology, B-102, or N-methyl amisulpride, benzamide","http://lbpharma.us/","$10 Million","Series B","Undisclosed"
"InventisBio","China","Sep","2020","Early Stage Biotech","oncology, cancer, oral selective estrogen receptor degrader (SERD), ER-positive, HER2 negative breast cancer. D-0502","http://www.inventisbio.com/en/index.html","$147 Million","Series D","Hillhouse affiliate GL Ventures, brought back existing shareholders – Lilly Asia Venture, ObiMed Asia, Pudong Innotek, AdvanTech Capital and CMB International – and introduced new ones, including Qiming Venture Partners, Janchor, AIHC Capital, Matrix Partner China, Dyee Captial and E Fund Capital"
"IonPath","USA","Sep","2020","Medical Imaging","Spatial proteomics, Multiplexed Ion Beam Imaging (MIBI) technology","https://www.ionpath.com/","$18 Million","Series B","Samsara BioCapital, Bruker, Genoa Ventures, ND Capital, Paladin Partners Investments, Trancos Ionpath Investors, Norwich Ventures, and Vertical Venture Partners Growth Fund"
"Koneksa","USA","Sep","2020","Digital Health","digital biomarkers, digital health, wearables, clinical trials","https://www.koneksahealth.com/","$16 Million","Series B","Spring Mountain Capital and joined by investments from McKesson Ventures, Novartis Pharma AG, and MBX Capital"
"Galecto","Denmark","Sep","2020","Early Stage Biotech","cancer, fibrosis, idiopathic pulmonary fibrosis (IPF), GB0139, oral galectin-3 inhibitor, GB1211, in liver scarring linked to non-alcoholic steatohepatitis (NASH), and GB2064, an oral LOLX2 inhibitor","https://galecto.com/","$64 Million","Series B"," Soleus Capital and co-led by Eir Ventures. Several new investors joined the round: Cormorant Asset Management, Janus Henderson Investors, Hadean Ventures, Sphera, Asymmetry Capital Management, Canica, as well as current investors. These include OrbiMed, Ysios Capital, Novo Holdings, HBM Healthcare Investments, Sunstone Capital, Bristol Myers Squibb, Seventure and Maverick Ventures"
"lias Biologics","South Korea","Sep","2020","Early Stage Biotech","exosome, inflammatory disease,  EXPLOR (exosome engineering for protein loading via optically reversible protein-protein interaction)","http://www.iliasbio.com/","$20.6 Million","Series B","HB Investment, Timefolio Asset Management, and Daedeok Venture Partners joined this round with follow-on investment. The new institutional investors, including Asset One, Devsisters Ventures, Meritz Securities, Kiwoom Securities, Daishin Securities, Hanyang Securities/Yeolim Partners, and Genie Asset Management "
"BioShin","China","Sep","2020","Early Stage Biotech","neuroscience","https://www.bioshin.com/en","$60 Million","Series A","OrbiMed, with participation from Cormorant Asset Management LLC, HBM Healthcare Investments Ltd, Surveyor Capital (a Citadel Company), and Suvretta Capital Management, LLC"
"Aclipse Therapeutics","Australia","Sep","2020","Early Stage Biotech","Amyotrophic Lateral Sclerosis (ALS), motor neuron disease (MND) or Lou Gehrig's disease","https://www.aclipsetherapeutics.com/","AUD 1 Million (US$720k)","Grant Funding","FightMND"
