"Company","Country","Month","Year","Classification","Keywords","Website","Funding Amount","Funding Type","Investors"
"PepGen","USA","Dec","2020","Rare Disease"," Oligonucleotide Platform, Duchenne Muscular Dystrophy, Rare Neuromuscular and Cardiac Diseases, cell-penetrating peptide technology","https://pepgen.com/","$45 Million","Series A","Oxford Sciences Innovation, The University of Oxford, and CureDuchenne Ventures"
"Reneo Pharmaceuticals","USA","Dec","2020","Rare Disease","genetic mitochondrial diseases, Primary mitochondrial myopathies (PMM), Fatty acid oxidation disorders (FAOD), McArdle disease (also known as glycogen storage disease type 5)","https://reneopharma.com/","$95 Million","Series B","Novo Ventures and Abingworth, New Enterprise Associates, RiverVest Venture Partners, Pappas Capital, and Lundbeckfonden Ventures, as well as new investors Rock Springs Capital, Aisling Capital, Amzak Health"
"Qu Biologics","USA","Dec","2020","Early Stage Biotech","Site Specific Immunomodulators (SSI), immunotherapies, inflammatory bowel disease, cancer, inflammatory lung disease and arthritis","https://www.qubiologics.com/","$8 Million","Series A","Undisclosed"
"Remix Therapeutics ","USA","Dec","2020","Early Stage Biotech","REMaster technology platform, RNA processing, cancer, rare diseases","https://www.remixtx.com/","$81 Million","Series A","Foresite Capital with participation from seed investors Atlas Venture and The Column Group. Additional investors joining the financing included Arch Venture and Alexandria Venture Investments"
"Edgewise Therapeutics","USA","Dec","2020","Early Stage Biotech","Muscular Dystrophy Program, rare muscle disease, Becker muscular dystrophy, EDG-5506","https://edgewisetx.com/","$95 Million","Series C","Viking Global Investors, Henderson Investors, Surveyor Capital (a Citadel company), RA Capital Management, Cormorant Asset Management, Logos Capital and Wellington Management"
"RayzeBio","USA","Dec","2020","Early Stage Biotech","radio biopharma, raido isotopes, oncology, cancer","https://rayzebio.com/","$105 Million","Series C","Venrock Healthcare Capital Partners (VHCP) alongside new investors OrbiMed, Redmile Group, Viking Global Investors, Logos Capital, Cormorant Asset Management, LifeSci Venture Partners, Alexandria Venture Investments "
"BRAINBox Solutions","USA","Dec","2020","Medical Diagnostics","Concussion Diagnostic/Prognostic Test, BRAINBox TBI (Traumatic Brain Injury) Test","https://brainboxinc.com/","$23 Million","Series A","BioVentures Investors, Tauber Foundation, the Virginia Tech Carilion Innovation and Seed Funds, Genoa VC, Pharmakon Holdings LLC, Astia Angels"
"Freespira","USA","Dec","2020","Digital Health","digital therapeutics, panic attacks, panic disorder and post-traumatic stress disorder (PTSD) ","https://freespira.com/","$10 Million","Series A","Lightspeed Venture Partners. Aphelion Capital, Medvest Capital, and Freespira Chairman, Russell Siegelman"
"Nuance Pharma","China","Dec","2020","Early Stage Biotech","iron deficiency, pain management and respiratory","http://www.nuancebiotech.com/en/","$181 Million","Series D","RTW Investments, LP, and GT Fund, CBC Group, Matrix Partners China and HBM Healthcare Investments"
"Exo Therapeutics","USA","Dec","2020","Early Stage Biotech","ExoSight platform, exosite drugs, structural and computational biology, protein engineering, and DNA-encoded libraries","","$25 Million ","Series A","Newpath Partners, Novartis Venture Fund, CRV and 6 Dimensions Capital"
"Kinomica","USA","Dec","2020","Medical Diagnostics","protein phosphorylation patterns, mass spectrometry, AML test, drug midostaurin","https://www.kinomica.com/","£3.9 Million ($5.1 Million)","Seed","BGF and Longwell Venture Partners each invested £1.5 million. The additional £900,000 was secured from seed investors including BioCity, Alderley Park Ventures, and Puffin Point"
"LocanaBio","USA","Dec","2020","Genomics/Gene Therapy","RNA-Targeted Gene Therapies,  neurodegenerative, neuromuscular and retinal diseases, Huntington's disease, myotonic dystrophy type 1, genetic forms of amyotrophic lateral sclerosis and retinal disease","https://locanabio.com/","$100 Million","Series B","Vida Ventures LLC with participation from RA Capital Management, Invus, Acuta Capital Partners, an investment fund associated with SVB Leerink Prior Locanabio investors ARCH Venture Partners, Temasek, Lightstone Ventures, UCB Ventures and GV"
"Singlera Genomics","USA","Dec","2020","Medical Diagnostics","pan-cancer early screening, oncology, cancer","https://singleraoncology.com/","$150 Million","Series B","CICC Kai Tak Innovative Biomedicine Fund, and co-led by Detong Capital and Furong Investment. The new group of investors also include Huamei International, Linden Asset Group, Wuxi Capital, FutureX Skyline Capital, Shanghai Free Trade Zone Fund, and initial investors from the Series A round such as Greenpine Capital, Prosperico Ventures, and Proxima Ventures "
"Naveris","USA","Dec","2020","Medical Diagnostics","Blood Tests for Early Detection of HPV and Other Viral-Related Cancers","https://naveris.com/","$19 Million","Series A","Gurnet Point Capital joined by R-Cubed Capital Partners and Sky Ventures Group"
"Octave Bioscience","USA","Dec","2020","Digital Health","care management, neurodegenerative diseases starting with multiple sclerosis (MS)","https://www.octavebio.com/","$32 Million","Series B","Northpond Ventures, Deerfield Management and Casdin Capital, The Blue Venture Fund, Echo Health Ventures and Section 32"
"Clarity Pharmaceuticals","Australia","Dec","2020","Early Stage Biotech","personalixed medicine, radiopharmaceuticals, Cu-64/Cu-67 SARTATE Neuroblastoma, SAR-Bombesin, Cu-64 BOmbesin in Breast CAncer Trial, SAR-bisPSMA, SAR Technology Platform, rare peditric","https://www.claritypharmaceuticals.com/","$25 Million","Series A",""
"dMed","USA","Dec","2020","Misc","CRO,  consulting, regulatory affairs & strategy, early clinical development, clinical science & medical affairs, clinical operations, biostatistics & programming, data management, drug safety & pharmacovigilance, quality assurance and information solutions","http://www.dmedglobal.com/","$100 MIllion","Series C","Fidelity Management & Research Company, LLC, new investors in dMed include Sequoia Capital China, Kaiser Foundation Hospitals and E Fund., Qiming Venture Partners, Lilly Asia Ventures, and Vivo Capital"
